{
  "config_identity": {
    "npc_auto_conf": {
      "path": "npc/rv64/include/config/auto.conf",
      "sha256": "ed0f2ab770451d3ae640978407f6e2eef1e39ff9dc93a0d3e4f88dabf4b59df4",
      "size_bytes": 641
    },
    "npc_autoconf_header": {
      "path": "npc/rv64/include/generated/autoconf.h",
      "sha256": "ac5cd6496f3501c80b33f0ab4ee1e466805b526475d62a8ec7376b62935be5b9",
      "size_bytes": 828
    },
    "npc_config": {
      "path": "npc/rv64/.config",
      "sha256": "63ecfda4b377430c468116a77efb77345705c3fcf9aca499b641b287cc6da5ce",
      "size_bytes": 1257
    }
  },
  "defect_ids": [
    "HIST-A3-DMESG-DEBUG-TOKEN",
    "HIST-EXIT-ACTIVE-MEM-EARLY-TERMINAL",
    "HIST-SER-QH-STOP-HOLD-DROP",
    "HIST-SER-QH-YOUNGER-STORE-CYCLE",
    "HIST-V8L-FORCE-RELEASE-SHADOW",
    "HIST-V9P-TERMINAL-COLLECTOR-INGRESS-DUP"
  ],
  "defect_status": {
    "HIST-A3-DMESG-DEBUG-TOKEN": "BACKFILLED_CURRENT_DESIGN",
    "HIST-EXIT-ACTIVE-MEM-EARLY-TERMINAL": "BACKFILLED_CURRENT_DESIGN",
    "HIST-SER-QH-STOP-HOLD-DROP": "BACKFILLED_CURRENT_DESIGN",
    "HIST-SER-QH-YOUNGER-STORE-CYCLE": "BACKFILLED_CURRENT_DESIGN",
    "HIST-V8L-FORCE-RELEASE-SHADOW": "BACKFILLED_CURRENT_DESIGN",
    "HIST-V9P-TERMINAL-COLLECTOR-INGRESS-DUP": "BACKFILLED_CURRENT_DESIGN"
  },
  "design_id": "sha256:337de8bf9bb72a57ab50570313521cd282c49f88df9cb88417c47673af4a6968",
  "evidence_reuse_contract": {
    "artifact_state": "TOP_LEVEL_RECEIPTS_PATH_SHA256_SIZE_BOUND_AND_RETAINED_LOGS_SHA256_BOUND",
    "assertion_state": "POSITIVE_ZERO_FAILURE_AND_COMPILE_SUCCESS_NEGATIVE_REJECTION_REQUIRED",
    "build_product_state": "REGENERABLE_SIMULATOR_IMAGES_REMOVED_AFTER_HASH_RECEIPT",
    "compile_sidefile_state": "REMOVED_ZERO_RC_HASH_RECEIPT_CROSSCHECKED_WITH_RETAINED_TB_LOG",
    "execution_state": "ORIGINAL_STATUS_IMMUTABLE",
    "full_system_rerun": false,
    "oracle_state": "VERSIONED_REPLAY_WITH_KNOWN_GOOD_AND_EXPECTED_FAIL_FIXTURES",
    "replay_state": "ONLY_TARGETED_HISTORICAL_RTL_AND_ORACLE_REPLAYS",
    "rerun_on": [
      "production_or_elaborated_rtl_change_in_the_bound_owner_cone",
      "active_device_model_host_harness_or_simulator_semantics_change",
      "configuration_workload_or_frozen_input_identity_change",
      "missing_raw_terminal_assertion_or_post_hash_evidence",
      "mutation_anchor_or_expected_rejection_marker_drift"
    ],
    "shared_system_dependency": "LAYERED_SIGNOFF_AND_CURRENT_CHECKER_CONTRACT_REQUIRED"
  },
  "inputs": {
    "architecture_binding_tool": {
      "path": "npc/rv64/eval/ppa/tools/architecture_hard_gates.py",
      "sha256": "4f0b3a55f8ccaef525ef3fc3e8ca4e5bc2d7ee71c885168e5f185f6b5749d274",
      "size_bytes": 125852
    },
    "backfill_ledger_schema": {
      "path": "npc/rv64/eval/ppa/schemas/historical-defect-backfill-ledger-v1.schema.json",
      "sha256": "f55437e42a4ce8d40cfe71f649793b073514f0d89011d9e4a5fbd1bdab8393da",
      "size_bytes": 4169
    },
    "current_checker": {
      "path": "Linux/scripts/npc-systemd-strict-check.sh",
      "sha256": "1cb1c6b9e9c7440447dd3fa3f0759938e9d5e4aede90d87357676f32c71fbbe6",
      "size_bytes": 5522
    },
    "current_checker_test": {
      "path": "Linux/scripts/tests/test_npc_systemd_strict_check.py",
      "sha256": "d381684ee2d57ed918fcdd9d3ae4b1c616c1cc09fcfa69bdebe631062dd5cade",
      "size_bytes": 2376
    },
    "exit_current_runner": {
      "path": "npc/rv64/testbench/scripts/run_historical_exit_current.py",
      "sha256": "dcfbd7b88f2ac4898167f4f2f4902d16be1e755992fb6f14e680fc617bc877e9",
      "size_bytes": 17233
    },
    "historical_a3_checker_replay": {
      "path": ".github/task-runs/2026-07-28-rv64-v10f-a3-checker-replay-v2/checker-replay-v2-evidence.json",
      "sha256": "5274b0d67eae3472e8fe8df86b4fbf49b7783eacc375d8b5e2e11c96b7881af8",
      "size_bytes": 13461
    },
    "historical_a3_original_status": {
      "path": ".github/task-runs/2026-07-27-rv64-v10e-current-design-system-recert/rootfs-c1b531-systemd-strict-6b-a3.status",
      "sha256": "85b2bccb227bb9c0b35fa0284a3bea8912ebca0c8cfec2579e3e8fee714062d8",
      "size_bytes": 70
    },
    "historical_qh_reconstruction": {
      "path": ".github/task-runs/2026-07-29-rv64-hist-ser-qh-younger-store-cycle/evidence/historical-reconstruction/summary.json",
      "sha256": "a7c15649be90432aa6961671b10e1be06ade4ddef18e8e06846fb6f3cd7b9fa0",
      "size_bytes": 14215
    },
    "historical_stop_hold_matrix": {
      "path": ".github/task-runs/2026-07-29-rv64-hist-ser-qh-stop-hold-drop/evidence/stop-hold-matrix/summary.json",
      "sha256": "8f989410a6037cee1eba4cb04255af6e72b4b827f99583a0dd2165ff95f0bd8c",
      "size_bytes": 13425
    },
    "historical_v8l_matrix": {
      "path": ".github/task-runs/2026-07-20-rv64-v8l-global-producer-no-live-reuse/evidence/focused/mutation-summary.json",
      "sha256": "d142f039cb9c2fc3c239b9920074e6a04e85e1493fd1706e00bdeb7630f66cdc",
      "size_bytes": 10803
    },
    "historical_v9p_root_cause": {
      "path": ".github/task-runs/2026-08-05-rv64-v15g-v9p-terminal-root-cause-backfill/evidence/v9p-root-cause-summary.json",
      "sha256": "653fc5387f38df567c17f3418eca44381d50c503251530cf6fbd8400eab01220",
      "size_bytes": 6604
    },
    "layered_system_current": {
      "path": "npc/rv64/eval/ppa/evidence/layered-system-signoff-current.json",
      "sha256": "2330a0644e55d5d9801cbba36836801f3dc5ad319cf5c6aa55fb0ed992dfc1b7",
      "size_bytes": 15303
    },
    "receipt_schema": {
      "path": "npc/rv64/eval/ppa/schemas/historical-defect-current-v1.schema.json",
      "sha256": "440264de564a0ef6a91e75f66b82a5bc001a2648e7780756139ae07147288640",
      "size_bytes": 4894
    },
    "receipt_tool": {
      "path": "npc/rv64/eval/ppa/tools/historical_defect_current.py",
      "sha256": "7039f4d1bc04d1b30b0f41362397ce6add316fd1987a47bf24c20630773c8ac9",
      "size_bytes": 103215
    },
    "v15g_exit_current": {
      "path": ".github/task-runs/2026-08-07-rv64-v15q-selector-state-reconciliation-337de8bf/evidence/historical-current-v1/exit/summary.json",
      "sha256": "8819158b15e85226a54c89d30cf636e4234b86235fa0acac903d0a89774a492d",
      "size_bytes": 17535
    },
    "v15g_independent_review": {
      "path": ".github/task-runs/2026-08-05-rv64-v15g-v9p-terminal-root-cause-backfill/evidence/independent-review.json",
      "sha256": "fe68086d6ab0f8bcead93f7c05ec817e34bc11723920552a339f5a23b8c315c7",
      "size_bytes": 1891
    },
    "v15g_root_cause_verifier": {
      "path": ".github/task-runs/2026-08-05-rv64-v15g-v9p-terminal-root-cause-backfill/verify-v9p-root-cause.py",
      "sha256": "17f544f7f76c0c51ad1736da0e45a7d5af84acd84d0eff0bd88d6cb441bff72a",
      "size_bytes": 23901
    },
    "v15g_serialize_qh_current": {
      "path": ".github/task-runs/2026-08-07-rv64-v15q-selector-state-reconciliation-337de8bf/evidence/historical-current-v1/qh/summary.json",
      "sha256": "9c8ae81d9aadd2bb827bf4c2f056e445cb6445100de41c0153145534b8eb8e25",
      "size_bytes": 253964
    },
    "v15g_serialize_system_current": {
      "path": ".github/task-runs/2026-08-07-rv64-v15q-selector-state-reconciliation-337de8bf/evidence/historical-current-v1/system/summary.json",
      "sha256": "c8ed68fe350c692b4eb712ceef307a1a1ed20025764aa54eadb9302f5c37fb10",
      "size_bytes": 707316
    },
    "v15g_v8l_current": {
      "path": "npc/rv64/eval/ppa/evidence/global-producer-no-live-reuse-current.json",
      "sha256": "ce4bfaf09ed0bdd28fc8e69c176d90fc02d1189a3f2358db08c33f54b9839a1c",
      "size_bytes": 81779
    },
    "v15p_adapter_mutation_log": {
      "path": ".github/task-runs/2026-08-06-rv64-v15p-adapter-final-b-fallthrough-f7a/evidence/l0/v15p-adapter-final-b-mutation/mutation/logs/tb_ooo_owner_timing_causal_probe.log",
      "sha256": "63824d914ca187129e3a4243f6217010e052f910fa53fb9de4b75b753fb093fa",
      "size_bytes": 2457
    },
    "v15p_adapter_mutation_result": {
      "path": ".github/task-runs/2026-08-06-rv64-v15p-adapter-final-b-fallthrough-f7a/evidence/l0/v15p-adapter-final-b-mutation/result.txt",
      "sha256": "547a6c56b60c272b56802197f2d121c9bc27a7e66f8e84ad461f4a7ec6b8242d",
      "size_bytes": 673
    },
    "v15p_adapter_review_closure": {
      "path": ".github/task-runs/2026-08-06-rv64-v15p-adapter-final-b-fallthrough-f7a/evidence/independent-review-closure-v2.txt",
      "sha256": "e8317fd754b000d5720ee6b8bfb592dcd74b8f3bcc4565c0f10fa36430916e51",
      "size_bytes": 2872
    },
    "v15p_adapter_review_result": {
      "path": ".github/task-runs/2026-08-06-rv64-v15p-adapter-final-b-fallthrough-f7a/subagent-contracts/v15p-loop-adapter-evidence-closure-review-v2.result.md",
      "sha256": "d80d6096ca5acc11d346123820d0c24a893716d589a4f9a3ae0223439dd890c5",
      "size_bytes": 3782
    },
    "v15p_adapter_testbench": {
      "path": "npc/rv64/testbench/tests/tb_ooo_lsu_axi_lane_adapter.sv",
      "sha256": "b648ce4a00011f9ccebcd98b7d39ee69c81862f7c3d84c8b3451eb76c14ddbfd",
      "size_bytes": 23507
    },
    "v15p_current_adapter": {
      "path": "npc/rv64/vsrc/memory/OooLsuAxiLaneAdapter.v",
      "sha256": "6d81b143e92992dfdd02b31a5b72c57ca69d3ffcbc626d00e7bb5ad3fb3a0e22",
      "size_bytes": 18405
    },
    "v15p_current_adapter_log": {
      "path": ".github/task-runs/2026-08-07-rv64-v15p-control-loop-current-f7a/evidence/module/logs/tb_ooo_lsu_axi_lane_adapter.log",
      "sha256": "99f427762e80010dc437f1115c963f5657b961639aa30707f40c3d8e3a2e3554",
      "size_bytes": 851
    },
    "v15p_current_module_result": {
      "path": ".github/task-runs/2026-08-07-rv64-v15p-control-loop-current-f7a/evidence/module/result.json",
      "sha256": "c733e5735570ffa19ddd5239d444b45b9ae55574b4b28597705756fd36ac9cd2",
      "size_bytes": 42270
    },
    "v15p_owner_timing_testbench": {
      "path": "npc/rv64/testbench/tests/tb_ooo_owner_timing_causal_probe.sv",
      "sha256": "b13ef4cfc4140c1c2471fb60b39b808854a2a9ed2f5b0f920ecf52b1ca9bf988",
      "size_bytes": 15167
    },